{
  "schemaVersion": "AUDIT-LEDGER-VERIFICATION-1.0.0",
  "runId": "019bf18e-6c00-7000-8000-000000000012",
  "mode": "full-chain",
  "startSequence": 0,
  "endSequence": 41,
  "verifiedHeadSequence": 41,
  "verifiedHeadHash": "aaaaaaaaaaaaaaaaaaaaaaaaaaaaaaaaaaaaaaaaaaaaaaaaaaaaaaaaaaaaaaaa",
  "healthy": true,
  "startedAt": "2026-07-20T02:00:00Z",
  "completedAt": "2026-07-20T02:00:15Z",
  "traceId": "0123456789abcdef0123456789abcdef"
}
